{
  "$schema": "https://json-schema.org/draft/2020-12/schema",
  "$id": "https://chief-wiggum.dev/schemas/bet.json",
  "title": "Bet Record",
  "description": "A bounded venture experiment (`bets/<bet-id>/bet.json` in the portfolio repo, written by scripts/bet.py — see docs/business-factory.md, chief-wiggum#235). A bet is under ~$1k to prove and ~3 months to a kill decision. The embedded `envelope` is a GOALPOST artifact: content-hashed into the portfolio journal at create; `bet.py rebaseline` is the only sanctioned mutation path (Adner & Levinthal 2004 — abandonment conditions must not be retroactively redefined). `state` is maintained by `bet.py transition` only; stage labels are derived from evidence, never self-declared unlocks.",
  "type": "object",
  "required": ["id", "title", "created", "state", "envelope"],
  "additionalProperties": false,
  "properties": {
    "$comment": { "type": "string" },
    "id": {
      "type": "string",
      "minLength": 1,
      "pattern": "^[A-Za-z0-9][A-Za-z0-9._-]*$",
      "description": "Stable bet id — the `bets/<id>/` directory name."
    },
    "title": { "type": "string", "minLength": 1 },
    "thesis": {
      "type": "string",
      "description": "The falsifiable thesis this bet exists to test. A pivot closes this bet (criteria evaluated against THIS thesis) and opens a successor with a fresh one."
    },
    "created": { "type": "string", "description": "ISO timestamp the bet was created." },
    "state": {
      "type": "string",
      "enum": ["proposed", "probing", "validating", "building", "scaling", "kill_pending", "killed", "parked", "lifestyle", "sold", "wound_down"],
      "description": "proposed → probing → validating → building → scaling; kill_pending reachable from anywhere; terminals killed|parked|lifestyle|sold|wound_down. `killed` is blocked until retrospective.md exists non-trivially and a harvest check ran. `wound_down` (chief-wiggum#274) is a distinct terminal for a PLANNED graceful hold-then-shutdown (or handing the product to a loyal customer) — the normal ending for a small vertical vendor, not a kill, and it carries no retrospective/harvest requirement of its own. `lifestyle` is the LIVE terminal: a revenue-producing, support-consuming product that earns zero in-flight slots forever — its measured ongoing_load feeds the portfolio's attention-capacity accounting (see `bet.py`'s LIVE_STATES)."
    },
    "envelope": { "$ref": "#/$defs/envelope" },
    "acquisition": {
      "type": "object",
      "additionalProperties": false,
      "description": "The acquisition plan the bet-selection lint reads (chief-wiggum#235 amendment): while means.json says sales/marketing novice and no channel has reached `focused`, a plan with neither an ecosystem channel nor an owned audience is flagged.",
      "properties": {
        "ecosystem_channel": {
          "type": ["string", "null"],
          "description": "A built-in-distribution ecosystem channel (marketplace, app store, plugin directory, ...) this bet ships into, or null."
        },
        "owned_audience": {
          "type": ["string", "null"],
          "description": "An owned audience (list, following, community) the plan draws on, or null."
        }
      }
    },
    "means_refs": {
      "type": "array",
      "items": { "type": "string" },
      "description": "References into portfolio means.json entries (skills/assets/network/owned_audience ids or names) this bet draws on — effectuation bird-in-hand: a proposal must reference the means it uses."
    },
    "harvest_inputs": {
      "type": "object",
      "additionalProperties": false,
      "description": "Inputs to the harvest check run before a `killed` transition: est sale value = 3.9 × TTM seller-discretionary profit (Acquire.com micro-SaaS median) vs wind-down cost. Absent inputs → the check reports `skipped`, never blocks silently, never crashes.",
      "properties": {
        "ttm_sdp_usd": { "type": "number", "minimum": 0, "description": "Trailing-twelve-month seller-discretionary profit, USD." },
        "wind_down_cost_usd": { "type": "number", "minimum": 0, "description": "Cost of winding the bet down (time, refunds, contract exits), USD." }
      }
    },
    "unlocked_milestones": {
      "type": "array",
      "items": { "type": "string" },
      "description": "Milestone ids whose tranches have been unlocked (journaled human acts via `bet.py transition --unlock-milestone`). Invariant: cumulative spend ≤ cumulative unlocked tranches."
    },
    "rep_cadence_per_week": {
      "type": "number",
      "exclusiveMinimum": 0,
      "description": "Per-bet rep-cadence override (chief-wiggum#241 leg 3): Mom-Test conversations required per trailing week while probing|validating, counted from the ledger's rep entries. Set at create (`bet.py create --cadence`, journaled); absent → default 3. Missed cadence is a report-only finding feeding the kill review as distribution-not-attempted evidence."
    },
    "target_cac_usd": {
      "type": "number",
      "minimum": 0,
      "description": "Target CAC the channel engine (scripts/channel.py, #241) joins measured channel-CAC against for focused channels. Absent → the join reports skipped, never a finding."
    },
    "headcount": {
      "type": "integer",
      "minimum": 0,
      "description": "Paid heads on this bet (excluding the founder). The channel engine's zero-headcount filter flags sales-led channels (sales, business-development) while this is 0. Absent → falls back to means.json headcount, then 0."
    },
    "target_load_hours_per_week": {
      "type": "number",
      "exclusiveMinimum": 0,
      "description": "Per-bet override of the addition-rule target load (chief-wiggum#274, §9.6.3): the most recently added LIVE (lifestyle) product must run below this for two consecutive trailing weekly periods before another bet may start. Absent → defaults to ATTENTION_LOAD_THRESHOLD_HOURS (2h/wk)."
    },
    "mrr_usd": {
      "type": "number",
      "minimum": 0,
      "description": "Current monthly recurring revenue, USD — operator-entered (not derivable in-repo), unlike ongoing_load which is always measured. Feeds the attention kill criterion (chief-wiggum#274, §9.6.3): a live product costing more than ATTENTION_LOAD_THRESHOLD_HOURS/wk while earning less than ATTENTION_REVENUE_THRESHOLD_USD MRR is a kill-or-redesign candidate. Absent → the check is silent for this bet, never guessed."
    },
    "predecessor": {
      "type": ["string", "null"],
      "description": "Bet id this bet succeeded via a pivot, or null."
    },
    "successor": {
      "type": ["string", "null"],
      "description": "Bet id opened when this bet was closed by a pivot, or null. Pivot is a transition, not an edit."
    },
    "low_cap_screens": {
      "type": "object",
      "additionalProperties": false,
      "description": "Operator-entered facts for the six low-cap distribution-divergence screens (chief-wiggum#275, docs/business-factory.md §9.6.5 screens 8-13 — candidate additions to the §9.5 standing screens). ALL report-only (docs/gate-rollout.md): findings are printed, never gate, until validated against a real candidate set. Every sub-field absent means that screen is UNRESOLVED (cannot run — a screen that cannot run must say so, never silently pass), not a pass.",
      "properties": {
        "enumerable_buyers_count": {
          "type": ["integer", "null"], "minimum": 0,
          "description": "Screen 8: named prospects producible from public sources in an afternoon. Pass window is 500-5,000 inclusive; below 500 is 'no list, no distribution, no business', above 5,000 is the dead zone too big for personal outbound and too small for paid."
        },
        "support_hazard": {
          "type": "object", "additionalProperties": false,
          "description": "Screen 9: support-obligation hazard. Reject real-time/critical-path/regulatory-deadline functionality — a solo operator cannot carry an on-call obligation. Reaches the same conclusion as #260's regulated-calculation-liability rabbitry kill from the attention direction rather than liability — the convergence is corroboration, not two overlapping checks.",
          "properties": {
            "has_realtime_or_regulatory_hazard": { "type": "boolean" }
          }
        },
        "structural_retention": {
          "type": "object", "additionalProperties": false,
          "description": "Screen 10: structural retention. Passes if the product stores records the buyer must retain >=5 years, OR runs a weekly-recurring workflow. Satisfaction is not retention.",
          "properties": {
            "retention_years": { "type": ["number", "null"], "minimum": 0 },
            "weekly_recurring_workflow": { "type": ["boolean", "null"] }
          }
        },
        "channels": {
          "type": "array",
          "description": "Screen 11: channel existence. Passes if >=1 entry meets its type's bar: association_newsletter cost_usd < 500, trade_show attendees < 5000, member_group members > 2000, or app_marketplace (existence alone is the bar — a browsed marketplace).",
          "items": {
            "type": "object",
            "required": ["type"],
            "additionalProperties": false,
            "properties": {
              "type": {
                "type": "string",
                "enum": ["association_newsletter", "app_marketplace", "trade_show", "member_group"]
              },
              "name": { "type": "string" },
              "cost_usd": { "type": "number", "minimum": 0 },
              "attendees": { "type": "integer", "minimum": 0 },
              "members": { "type": "integer", "minimum": 0 }
            }
          }
        },
        "dark_matter_demand": {
          "type": "object", "additionalProperties": false,
          "description": "Screen 12: dark-matter demand. Passes if 10-300 searches/mo across a 10-20 keyword cluster with nonzero CPC, OR >=3 findable 'what software do you use for X' threads. Supersedes the cruder 'reject if search volume is high' heuristic: volume alone is ambiguous, volume-with-commercial-intent is the signal.",
          "properties": {
            "keyword_cluster_size": { "type": ["integer", "null"], "minimum": 0 },
            "monthly_searches": { "type": ["integer", "null"], "minimum": 0 },
            "nonzero_cpc": { "type": ["boolean", "null"] },
            "so_threads_count": { "type": ["integer", "null"], "minimum": 0 }
          }
        },
        "opportunity_cost": {
          "type": "object", "additionalProperties": false,
          "description": "Screen 13: opportunity-cost benchmark. The bet is judged against the operator's contracting rate for the same hours (means.json contracting_rate_usd_per_hour) — never against zero, never against venture outcomes. This is the counterfactual the startup corpus never forces; the ledger had no field for it before #275.",
          "properties": {
            "projected_mrr_usd": { "type": "number", "minimum": 0 },
            "projected_hours_per_week": { "type": "number", "exclusiveMinimum": 0 }
          }
        }
      }
    }
  },
  "$defs": {
    "envelope": {
      "type": "object",
      "required": ["cash_cap_usd"],
      "additionalProperties": false,
      "description": "Affordable-loss envelope (Dew et al. 2009 field list), human-set, script-enforced, raisable only via `bet.py rebaseline` (a journaled act with a required --reason).",
      "properties": {
        "cash_cap_usd": { "type": "number", "minimum": 0 },
        "time_cap_hours": { "type": "number", "minimum": 0 },
        "calendar_cap_days": { "type": "number", "minimum": 0 },
        "attention_slots": { "type": "number", "minimum": 0 },
        "liability_exposure": {
          "description": "The affordable-loss envelope's liability/exposure dimension (chief-wiggum#277) — Dew et al.'s 2009 field list omits it, so an uncapped contractual indemnity records identically to no exposure at all. Enumerated, never free text. `bet.py create`/`rebaseline` flag this field's total ABSENCE as a soundness finding; a STATED value — including uncapped_entity/uncapped_personal — is NEVER itself a finding, at create or anywhere else: the operator's risk appetite is a deliberate, sized, counted choice (docs/business-factory.md §9.4 addendum: terms as an undercutting mechanism), not a defect. See also the portfolio-level uncapped-liability concurrency count (`bet.py portfolio`) — one such bet is a considered risk, several concurrently is a portfolio-survival question.",
          "oneOf": [
            {
              "type": "object", "required": ["type", "amount_usd"], "additionalProperties": false,
              "properties": {
                "type": { "const": "capped_at" },
                "amount_usd": { "type": "number", "minimum": 0, "description": "The liability cap, USD." }
              }
            },
            {
              "type": "object", "required": ["type", "policy"], "additionalProperties": false,
              "properties": {
                "type": { "const": "insured" },
                "policy": { "type": "string", "minLength": 1, "description": "Policy name/id covering this exposure." },
                "responds": {
                  "type": "string", "enum": ["yes", "unverified", "no"],
                  "description": "Insurability is a separate fact from insurance (#277 decision 2): holding a policy does not establish that it responds to a contractually-assumed liability — a common PI exclusion. Defaults to `unverified` when absent; only a human answer moves it to yes/no."
                }
              }
            },
            {
              "type": "object", "required": ["type"], "additionalProperties": false,
              "properties": { "type": { "const": "uncapped_entity" } },
              "description": "Unbounded liability held by the operating entity."
            },
            {
              "type": "object", "required": ["type"], "additionalProperties": false,
              "properties": { "type": { "const": "uncapped_personal" } },
              "description": "Unbounded liability with personal exposure (no entity shield, or the entity does not cure it)."
            }
          ]
        },
        "tranches": {
          "type": "array",
          "description": "Gompers (1995) staging: the cash cap released stepwise. A tranche with unlock_milestone_id null is unlocked from creation; others unlock via a journaled `--unlock-milestone` act. Invariant: cumulative spend ≤ cumulative unlocked tranches.",
          "items": {
            "type": "object",
            "required": ["amount_usd", "unlock_milestone_id"],
            "additionalProperties": false,
            "properties": {
              "amount_usd": { "type": "number", "minimum": 0 },
              "unlock_milestone_id": { "type": ["string", "null"] }
            }
          }
        }
      }
    }
  }
}
